grant_no,unit_sector,country,beneficiary,address,project,eur,year,project_clean,unit_sector_long
2023/134,ECRET,Iraq,European Technology and Training Centre (NGO),"Nawroz Street, PO Box 45     44001, Erbil, Iraq",2023/CFP/POST/01,4739850,2023,2023/CFP/POST/01,European Centre for Returns
2023/141,ECRET,Pakistan,"Women Empowerment Literacy & Development Organisation, Non-profit Organisation (NGO)","Building 57, Road 26, DHA 1, Sector F, Islamabad 3061066-4",2023/CFP/POST/01,1219819,2023,2023/CFP/POST/01,European Centre for Returns
2023/142,ECRET,Egypt,Life Makers Foundation (NGO),3 Almashtal street- Elshishiny Devision- Corniche Elnile- Maadi Cairo 567710025,2023/CFP/POST/01,132611,2023,2023/CFP/POST/01,European Centre for Returns
2023/167,ECRET,Belgium,International Returns & Reintegration Assistance,"Breydelstraat 36, 1040 Brussels, Belgium",2023/CFP/POST/01,6332100,2023,2023/CFP/POST/01,European Centre for Returns
2023/176,ECRET,Belgium,Caritas International Belgium (NGO),rue de la Charité 43 ; 1210 Brussels,2023/CFP/POST/01,5468240,2023,2023/CFP/POST/01,European Centre for Returns
2023/178,ECRET,Belgium,Caritas International Belgium (NGO),rue de la Charité 43 ; 1210 Brussels,2023/CFP/POST/01,226510,2023,2023/CFP/POST/01,European Centre for Returns
